{
    "ontology_iri": "http://example.org/your_ontology.owl",
    "classes": {
        "ClassName1": "ParentClass1",
        "ClassName2": "ParentClass2",
        "ClassName3": "ParentClass3"
    },
    "object_properties": {
        "ObjectProperty1": {
            "domain": ["ClassName1"],
            "range": ["ClassName2"],
            "inverse_property": "InverseObjectProperty1",
            "property_type": ["TransitiveProperty"]
        },
        "ObjectProperty2": {
            "domain": ["ClassName2"],
            "range": ["ClassName3"]
        }
    },
    "data_properties": {
        "DataProperty1": {
            "domain": ["ClassName1"],
            "range": ["int"],
            "property_type": ["FunctionalProperty"]
        },
        "DataProperty2": {
            "domain": ["ClassName2"],
            "range": ["str"]
        }
    },
    "individuals": [
        {
            "name": "Individual1",
            "class": "ClassName1",
            "attributes": {
                "ObjectProperty1": ["RelatedIndividual1"],
                "DataProperty1": [42]
            }
        },
        {
            "name": "Individual2",
            "class": "ClassName2",
            "attributes": {
                "ObjectProperty2": ["RelatedIndividual2"],
                "DataProperty2": ["example string"]
            }
        }
    ],
    "disjoint_classes": [
        "ClassName1",
        "ClassName2",
        "ClassName3"
    ],
    "equivalent_classes": [
        {"class": "ClassName1", "equivalent_to": ["ClassName4"]}
    ],
    "general_axioms": [
        {"axiom_type": "TransitiveProperty", "properties": ["ObjectProperty1"]}
    ]
}
